<?xml version="1.0" ?>

<xs:schema xmlns:xs="http://www.w3.org/2001/XMLSchema">

	<xs:complexType name="BibliotecaType">
		<xs:sequence>
			<xs:element name="musicista" type="MusicistaType" minOccurs="0" maxOccurs="unbounded" />
		</xs:sequence>
	</xs:complexType>

	<xs:complexType name="MusicistaType">
		<xs:sequence>
			<xs:element name="nome" type="xs:string" />
			<xs:element name="cognome" type="xs:string" />
			<xs:element name="nomeArte" type="xs:string" minOccurs="0" />
			<xs:element name="genere" type="xs:string" />
			<xs:element name="album" type="AlbumType" minOccurs="1" maxOccurs="unbounded" />
		</xs:sequence>
	</xs:complexType>

	<xs:complexType name="AlbumType">
		<xs:sequence>
			<xs:element name="titoloAlbum" type="xs:string" />
			<xs:element name="annoPubblicazione" type="xs:positiveInteger" />
			<xs:element name="brano" type="BranoType" minOccurs="0" maxOccurs="unbounded" />
		</xs:sequence>
	</xs:complexType>

	<xs:complexType name="BranoType">
		<xs:sequence>
			<xs:element name="titoloBrano" type="xs:string" />
			<xs:element name="lunghezza">
				<xs:simpleType>
					<xs:restriction base="xs:string">
						<xs:pattern value="[0-9][0-9]:[0-9][0-9]" />
					</xs:restriction>
				</xs:simpleType>
			</xs:element>
		</xs:sequence>
	</xs:complexType>

	<xs:element name="bibliotecaMusicale" type="BibliotecaType" />
</xs:schema>